[
  {
    "event_id": "evt-park-1",
    "domain": "access",
    "type": "vehicle_entry",
    "timestamp": "2026-02-14T10:00:00Z",
    "meaning": {
      "action": "enter"
    }
  },
  {
    "event_id": "evt-park-2",
    "domain": "token",
    "type": "parking_token_validation",
    "timestamp": "2026-02-14T10:03:00Z",
    "meaning": {
      "token_id": "parking-session-001",
      "token_standard": "IOTA-TOKEN"
    }
  },
  {
    "event_id": "evt-park-3",
    "domain": "identity",
    "type": "identity_check",
    "timestamp": "2026-02-14T10:06:00Z",
    "meaning": {
      "subject_ref": "did:iota:user:abc123",
      "identity_status": "pending"
    }
  },
  {
    "event_id": "evt-park-4",
    "domain": "identity",
    "type": "identity_check",
    "timestamp": "2026-02-14T10:09:00Z",
    "meaning": {
      "subject_ref": "did:iota:user:abc123",
      "identity_status": "verified"
    }
  },
  {
    "event_id": "evt-park-5",
    "domain": "access",
    "type": "vehicle_exit",
    "timestamp": "2026-02-14T10:15:00Z",
    "meaning": {
      "action": "exit"
    }
  }
]
